{
  "schemaVersion": "0.1.0",
  "generator": {
    "name": "personal-knowledge-snapshot-builder",
    "version": "0.1.0"
  },
  "generatedAt": "2026-07-30T00:00:00.000Z",
  "sourceCommit": "31084951cbcfd675842fa4d017121de489e171c4",
  "objects": [
    {
      "id": "claim.structured-context-improves-model-usability",
      "type": "claim",
      "title": "Structured context improves model usability",
      "summary": "Explicit topic and context structure makes knowledge more usable to models than an undifferentiated file collection.",
      "status": "published",
      "sourcePath": "src/content/essays/llm-era-knowledge-engineering.mdx",
      "metadata": {
        "origin": "controlled-sidecar",
        "locator": "一个微小的实证"
      },
      "provenance": {
        "contentId": "claim.structured-context-improves-model-usability",
        "sourcePath": "src/content/essays/llm-era-knowledge-engineering.mdx",
        "sourceUrl": "https://zhi-yuan.space/essays/llm-era-knowledge-engineering",
        "contentHash": "fffe9307642682a40317e68cada3ea0d99b7d39698e6305fe15b6de4ec14c491",
        "visibility": "public",
        "collection": "essays",
        "idSource": "explicit",
        "extractedFields": [
          "controlled-sidecar"
        ],
        "sectionTitle": "一个微小的实证"
      }
    },
    {
      "id": "concept.enterprise-ai",
      "type": "concept",
      "title": "Enterprise AI",
      "slug": "enterprise-ai",
      "summary": "AI 在真实企业环境中的落地：组织、流程、数据治理与投入产出，而不只是模型能力本身。",
      "status": "published",
      "sourcePath": "src/content/topics/enterprise-ai.md",
      "canonicalUrl": "https://zhi-yuan.space/topics/enterprise-ai",
      "metadata": {
        "collection": "topics",
        "topics": [],
        "idSource": "explicit"
      },
      "provenance": {
        "contentId": "concept.enterprise-ai",
        "sourcePath": "src/content/topics/enterprise-ai.md",
        "sourceUrl": "https://zhi-yuan.space/topics/enterprise-ai",
        "contentHash": "9554dd59284c48206026682d86cfc2c6acd3e2ffb7424ae4458443e063b6e6e6",
        "visibility": "public",
        "collection": "topics",
        "idSource": "explicit",
        "extractedFields": [
          "description",
          "featured",
          "order",
          "title"
        ]
      }
    },
    {
      "id": "concept.knowledge-engineering",
      "type": "concept",
      "title": "Knowledge Engineering",
      "slug": "knowledge-engineering",
      "summary": "如何把分散的信息、经验和判断，沉淀为结构化、可复用、可被机器与人共同使用的知识系统。",
      "status": "published",
      "sourcePath": "src/content/topics/knowledge-engineering.md",
      "canonicalUrl": "https://zhi-yuan.space/topics/knowledge-engineering",
      "metadata": {
        "collection": "topics",
        "topics": [],
        "idSource": "explicit"
      },
      "provenance": {
        "contentId": "concept.knowledge-engineering",
        "sourcePath": "src/content/topics/knowledge-engineering.md",
        "sourceUrl": "https://zhi-yuan.space/topics/knowledge-engineering",
        "contentHash": "a74d8cb49e3ad01a7e55614de32c76f4ac0db680a86183fd28ac56a7e2d67fb8",
        "visibility": "public",
        "collection": "topics",
        "idSource": "explicit",
        "extractedFields": [
          "description",
          "featured",
          "order",
          "title"
        ]
      }
    },
    {
      "id": "concept.lean-thinking",
      "type": "concept",
      "title": "Lean Thinking",
      "slug": "lean-thinking",
      "summary": "精益思想在软件开发与知识工作中的迁移：消除浪费、小批量流动、内建质量。",
      "status": "published",
      "sourcePath": "src/content/topics/lean-thinking.md",
      "canonicalUrl": "https://zhi-yuan.space/topics/lean-thinking",
      "metadata": {
        "collection": "topics",
        "topics": [],
        "idSource": "explicit"
      },
      "provenance": {
        "contentId": "concept.lean-thinking",
        "sourcePath": "src/content/topics/lean-thinking.md",
        "sourceUrl": "https://zhi-yuan.space/topics/lean-thinking",
        "contentHash": "61f9e99d8a817364cf6ec6265b8d87e912bf7ad07a92a2b382e8a4acde044c45",
        "visibility": "public",
        "collection": "topics",
        "idSource": "explicit",
        "extractedFields": [
          "description",
          "featured",
          "order",
          "title"
        ]
      }
    },
    {
      "id": "concept.llm-and-cognition",
      "type": "concept",
      "title": "LLM and Cognition",
      "slug": "llm-and-cognition",
      "summary": "从认知科学视角理解大语言模型：记忆、注意力、外部化思考，以及人机认知分工。",
      "status": "published",
      "sourcePath": "src/content/topics/llm-and-cognition.md",
      "canonicalUrl": "https://zhi-yuan.space/topics/llm-and-cognition",
      "metadata": {
        "collection": "topics",
        "topics": [],
        "idSource": "explicit"
      },
      "provenance": {
        "contentId": "concept.llm-and-cognition",
        "sourcePath": "src/content/topics/llm-and-cognition.md",
        "sourceUrl": "https://zhi-yuan.space/topics/llm-and-cognition",
        "contentHash": "92b3833391a1ffe9d9d1ada9547ac65ed886cd0ac40fd7f99add95ab2da46c08",
        "visibility": "public",
        "collection": "topics",
        "idSource": "explicit",
        "extractedFields": [
          "description",
          "featured",
          "order",
          "title"
        ]
      }
    },
    {
      "id": "concept.manufacturing-systems",
      "type": "concept",
      "title": "Manufacturing Systems",
      "slug": "manufacturing-systems",
      "summary": "制造系统的数字化：MES、工艺知识、设备数据与现场经验如何形成系统能力。",
      "status": "published",
      "sourcePath": "src/content/topics/manufacturing-systems.md",
      "canonicalUrl": "https://zhi-yuan.space/topics/manufacturing-systems",
      "metadata": {
        "collection": "topics",
        "topics": [],
        "idSource": "explicit"
      },
      "provenance": {
        "contentId": "concept.manufacturing-systems",
        "sourcePath": "src/content/topics/manufacturing-systems.md",
        "sourceUrl": "https://zhi-yuan.space/topics/manufacturing-systems",
        "contentHash": "b4de827afd7c60d48688fe2a3db976ddd360e4a1df1a2f6e3f86837de836f87c",
        "visibility": "public",
        "collection": "topics",
        "idSource": "explicit",
        "extractedFields": [
          "description",
          "featured",
          "order",
          "title"
        ]
      }
    },
    {
      "id": "document.about",
      "type": "document",
      "subtype": "article",
      "title": "About",
      "slug": "about",
      "summary": "关于我：研究兴趣、职业背景与联系方式。",
      "status": "published",
      "sourcePath": "src/content/pages/about.md",
      "canonicalUrl": "https://zhi-yuan.space/about",
      "updatedAt": "2026-07-29T00:00:00.000Z",
      "metadata": {
        "collection": "pages",
        "topics": [],
        "idSource": "fallback"
      },
      "provenance": {
        "contentId": "document.about",
        "sourcePath": "src/content/pages/about.md",
        "sourceUrl": "https://zhi-yuan.space/about",
        "contentHash": "062ccb5f3fbede80051194123b399145b788e58227dda25f9bf816d5a9944149",
        "visibility": "public",
        "collection": "pages",
        "idSource": "fallback",
        "extractedFields": [
          "description",
          "title",
          "updatedAt"
        ]
      }
    },
    {
      "id": "document.ai-agents-as-research-assistants",
      "type": "document",
      "subtype": "research-note",
      "title": "AI Agent 作为研究助理，而不是代笔",
      "slug": "ai-agents-as-research-assistants",
      "summary": "让 Agent 负责检索、核对和整理，人负责提问和判断——目前最可持续的分工。",
      "status": "published",
      "sourcePath": "src/content/notes/ai-agents-as-research-assistants.md",
      "canonicalUrl": "https://zhi-yuan.space/notes/ai-agents-as-research-assistants",
      "createdAt": "2026-07-12T00:00:00.000Z",
      "updatedAt": "2026-07-25T00:00:00.000Z",
      "metadata": {
        "collection": "notes",
        "topics": [
          "llm-and-cognition",
          "knowledge-engineering"
        ],
        "originalStatus": "growing",
        "idSource": "fallback"
      },
      "provenance": {
        "contentId": "document.ai-agents-as-research-assistants",
        "sourcePath": "src/content/notes/ai-agents-as-research-assistants.md",
        "sourceUrl": "https://zhi-yuan.space/notes/ai-agents-as-research-assistants",
        "contentHash": "35076488ae9d0226beea85e37ed68073fe84c5019d3a55b3d810c9c681722422",
        "visibility": "public",
        "collection": "notes",
        "idSource": "fallback",
        "extractedFields": [
          "createdAt",
          "description",
          "related",
          "status",
          "tags",
          "title",
          "topics",
          "updatedAt"
        ]
      }
    },
    {
      "id": "document.digital-garden-vs-traditional-blog",
      "type": "document",
      "subtype": "research-note",
      "title": "数字花园与传统博客的分界线",
      "slug": "digital-garden-vs-traditional-blog",
      "summary": "不是\"完成度\"的区别，而是时间轴和主题轴两种组织方式的区别。",
      "status": "published",
      "sourcePath": "src/content/notes/digital-garden-vs-traditional-blog.md",
      "canonicalUrl": "https://zhi-yuan.space/notes/digital-garden-vs-traditional-blog",
      "createdAt": "2026-06-28T00:00:00.000Z",
      "metadata": {
        "collection": "notes",
        "topics": [
          "knowledge-engineering"
        ],
        "originalStatus": "evergreen",
        "idSource": "explicit"
      },
      "provenance": {
        "contentId": "document.digital-garden-vs-traditional-blog",
        "sourcePath": "src/content/notes/digital-garden-vs-traditional-blog.md",
        "sourceUrl": "https://zhi-yuan.space/notes/digital-garden-vs-traditional-blog",
        "contentHash": "d883d0713b31812ccb5be1898ebcdfc15617a023413a592cbf3f7457b6d60a9f",
        "visibility": "public",
        "collection": "notes",
        "idSource": "explicit",
        "extractedFields": [
          "createdAt",
          "description",